mysql> CREATE DATABASE movie_production;
Query OK, 1 row affected (0.02 sec)

mysql> USE movie_production;
Database changed

mysql> CREATE TABLE Movie (
    -> movie_id INT PRIMARY KEY,
    -> title VARCHAR(255) NOT NULL,
    -> genre VARCHAR(100),
    -> budget DECIMAL(12,2),
    -> release_date DATE,
    -> duration INT,
    -> rating DECIMAL(3,1),
    -> studio_id INT
    -> );
Query OK, 0 rows affected (0.06 sec)

mysql> CREATE TABLE Director (
    -> director_id INT PRIMARY KEY,
    -> name VARCHAR(255) NOT NULL,
    -> experience INT,
    -> contact VARCHAR(15),
    -> awards_won VARCHAR(500)
    -> );
Query OK, 0 rows affected (0.05 sec)

mysql> CREATE TABLE Actor (
    -> actor_id INT PRIMARY KEY,
    -> name VARCHAR(255) NOT NULL,
    -> age INT,
    -> gender VARCHAR(10),
    -> experience INT,
    -> nationality VARCHAR(50)
    -> );
Query OK, 0 rows affected (0.05 sec)

mysql> CREATE TABLE Contract (
    -> contract_id INT PRIMARY KEY,
    -> actor_id INT,
    -> movie_id INT,
    -> role VARCHAR(100),
    -> salary DECIMAL(12,2),
    -> contract_term VARCHAR(255),
    -> FOREIGN KEY (actor_id) REFERENCES Actor(actor_id),
    -> FOREIGN KEY (movie_id) REFERENCES Movie(movie_id)
    -> );
Query OK, 0 rows affected (0.05 sec)

mysql> CREATE TABLE Studio (
    -> studio_id INT PRIMARY KEY,
    -> name VARCHAR(255) NOT NULL,
    -> country VARCHAR(100),
    -> contact VARCHAR(15),
    -> partnership_type VARCHAR(100)
    -> );
Query OK, 0 rows affected (0.05 sec)

mysql> CREATE TABLE Distributor (
    -> distributor_id INT PRIMARY KEY,
    -> name VARCHAR(255) NOT NULL,
    -> country VARCHAR(100),
    -> contact VARCHAR(15),
    -> partnership_type VARCHAR(100)
    -> );
Query OK, 0 rows affected (0.05 sec)

mysql> CREATE TABLE Marketing_Campaign (
    -> campaign_id INT PRIMARY KEY,
    -> movie_id INT,
    -> budget DECIMAL(12,2),
    -> strategy VARCHAR(500),
    -> social_media_presence VARCHAR(500),
    -> FOREIGN KEY (movie_id) REFERENCES Movie(movie_id)
    -> );
Query OK, 0 rows affected (0.05 sec)

mysql> CREATE TABLE Box_Office_Collection (
    -> collection_id INT PRIMARY KEY,
    -> movie_id INT,
    -> revenue DECIMAL(12,2),
    -> ticket_sales INT,
    -> opening_weekend_earnings DECIMAL(12,2),
    -> FOREIGN KEY (movie_id) REFERENCES Movie(movie_id)
    -> );
Query OK, 0 rows affected (0.05 sec)

mysql> CREATE TABLE Streaming_Platform (
    -> platform_id INT PRIMARY KEY,
    -> name VARCHAR(255) NOT NULL,
    -> subscription_model VARCHAR(100),
    -> country_availability VARCHAR(500)
    -> );
Query OK, 0 rows affected (0.05 sec)

mysql> CREATE TABLE Theatre (
    -> theatre_id INT PRIMARY KEY,
    -> name VARCHAR(255) NOT NULL,
    -> location VARCHAR(255),
    -> capacity INT,
    -> no_of_screens INT
    -> );
Query OK, 0 rows affected (0.05 sec)

mysql> ALTER TABLE Movie 
    -> ADD COLUMN director_id INT;
Query OK, 0 rows affected (0.02 sec)

mysql> ALTER TABLE Movie 
    -> ADD FOREIGN KEY (director_id) REFERENCES Director(director_id);
Query OK, 0 rows affected (0.02 sec)

mysql> INSERT INTO Movie (movie_id, title, genre, budget, release_date, duration, rating, studio_id, director_id) VALUES
    -> (101, 'Inception', 'Sci-Fi', 160000000.00, '2010-07-16', 148, 8.8, 501, 201),
    -> (102, '3 Idiots', 'Comedy-Drama', 55000000.00, '2009-12-25', 170, 8.4, 502, 202),
    -> (103, 'Interstellar', 'Sci-Fi', 165000000.00, '2014-11-07', 169, 8.6, 503, 203),
    -> (104, 'Baahubali', 'Action-Drama', 18000000.00, '2015-07-10', 159, 8.1, 504, 204);
Query OK, 4 rows affected (0.05 sec)
Records: 4  Duplicates: 0  Warnings: 0

mysql> INSERT INTO Director (director_id, name, experience, contact, awards_won) VALUES
    -> (201, 'Christopher Nolan', 25, '9876543210', 'Oscar Winner'),
    -> (202, 'Rajkumar Hirani', 20, '9988776655', 'Filmfare Winner'),
    -> (203, 'James Cameron', 35, '8877665544', 'Golden Globe Winner'),
    -> (204, 'S.S. Rajamouli', 22, '7766554433', 'National Award Winner');
Query OK, 4 rows affected (0.04 sec)
Records: 4  Duplicates: 0  Warnings: 0

mysql> INSERT INTO Actor (actor_id, name, age, gender, experience, nationality) VALUES
    -> (301, 'Leonardo DiCaprio', 48, 'Male', 30, 'American'),
    -> (302, 'Aamir Khan', 58, 'Male', 35, 'Indian'),
    -> (303, 'Matthew McConaughey', 54, 'Male', 30, 'American'),
    -> (304, 'Prabhas', 44, 'Male', 20, 'Indian');
Query OK, 4 rows affected (0.03 sec)
Records: 4  Duplicates: 0  Warnings: 0

mysql> INSERT INTO Contract (contract_id, actor_id, movie_id, role, salary, contract_term) VALUES
    -> (401, 301, 101, 'Lead Actor', 20000000.00, '2 Years'),
    -> (402, 302, 102, 'Lead Actor', 15000000.00, '3 Years'),
    -> (403, 303, 103, 'Lead Actor', 18000000.00, '2 Years'),
    -> (404, 304, 104, 'Lead Actor', 10000000.00, '1 Year');
Query OK, 4 rows affected (0.02 sec)
Records: 4  Duplicates: 0  Warnings: 0

mysql> INSERT INTO Studio (studio_id, name, country, contact, partnership_type) VALUES
    -> (501, 'Warner Bros', 'USA', '1234567890', 'Major'),
    -> (502, 'Vinod Chopra Films', 'India', '9988771122', 'Independent'),
    -> (503, 'Paramount Pictures', 'USA', '8877662211', 'Major'),
    -> (504, 'Arka Media Works', 'India', '7766551133', 'Independent');
Query OK, 4 rows affected (0.04 sec)
Records: 4  Duplicates: 0  Warnings: 0

mysql> INSERT INTO Distributor (distributor_id, name, country, contact, partnership_type) VALUES
    -> (601, 'Warner Bros Distribution', 'USA', '1122334455', 'Global'),
    -> (602, 'Reliance Entertainment', 'India', '2233445566', 'Domestic'),
    -> (603, '20th Century Fox', 'USA', '3344556677', 'Global'),
    -> (604, 'Yash Raj Films', 'India', '4455667788', 'Domestic');
Query OK, 4 rows affected (0.03 sec)
Records: 4  Duplicates: 0  Warnings: 0

mysql> INSERT INTO Marketing_Campaign (campaign_id, movie_id, budget, strategy, social_media_presence) VALUES
    -> (701, 101, 5000000.00, 'Online and Theatrical', 'Extensive'),
    -> (702, 102, 3000000.00, 'TV and Social Media', 'Moderate'),
    -> (703, 103, 6000000.00, 'Global Campaign', 'Extensive'),
    -> (704, 104, 2000000.00, 'Regional Ads', 'Limited');
Query OK, 4 rows affected (0.05 sec)
Records: 4  Duplicates: 0  Warnings: 0

mysql> INSERT INTO Box_Office_Collection (collection_id, movie_id, revenue, ticket_sales, opening_weekend_earnings) VALUES
    -> (801, 101, 830000000.00, 100000000, 62000000.00),
    -> (802, 102, 390000000.00, 80000000, 55000000.00),
    -> (803, 103, 677000000.00, 120000000, 75000000.00),
    -> (804, 104, 280000000.00, 90000000, 47000000.00);
Query OK, 4 rows affected (0.03 sec)
Records: 4  Duplicates: 0  Warnings: 0

mysql> INSERT INTO Streaming_Platform (platform_id, name, subscription_model, country_availability) VALUES
    -> (901, 'Netflix', 'Subscription', 'Worldwide'),
    -> (902, 'Amazon Prime', 'Subscription', 'Worldwide'),
    -> (903, 'Hotstar', 'Subscription', 'India'),
    -> (904, 'Hulu', 'Subscription', 'USA');
Query OK, 4 rows affected (0.02 sec)
Records: 4  Duplicates: 0  Warnings: 0

mysql> INSERT INTO Theatre (theatre_id, name, location, capacity, no_of_screens) VALUES
    -> (1001, 'PVR Cinemas', 'Mumbai', 500, 7),
    -> (1002, 'IMAX', 'New York', 700, 10),
    -> (1003, 'INOX', 'Delhi', 450, 5),
    -> (1004, 'Cinepolis', 'Los Angeles', 600, 8);
Query OK, 4 rows affected (0.02 sec)
Records: 4  Duplicates: 0  Warnings: 0

mysql> SHOW TABLES;
+-------------------------+
| Tables_in_movie_production |
+-------------------------+
| Actor                   |
| Box_Office_Collection   |
| Contract                |
| Director                |
| Distributor             |
| Marketing_Campaign      |
| Movie                   |
| Streaming_Platform      |
| Studio                  |
| Theatre                 |
+-------------------------+
10 rows in set (0.01 sec)

mysql> SELECT * FROM Movie;
+----------+----------------+---------------+------------+--------------+----------+--------+-----------+-------------+
| movie_id | title          | genre         | budget     | release_date | duration | rating | studio_id | director_id |
+----------+----------------+---------------+------------+--------------+----------+--------+-----------+-------------+
| 101      | Inception      | Sci-Fi        | 160000000  | 2010-07-16   | 148      | 8.8    | 501       | 201         |
| 102      | 3 Idiots       | Comedy-Drama  | 55000000   | 2009-12-25   | 170      | 8.4    | 502       | 202         |
| 103      | Interstellar   | Sci-Fi        | 165000000  | 2014-11-07   | 169      | 8.6    | 503       | 203         |
| 104      | Baahubali      | Action-Drama  | 18000000   | 2015-07-10   | 159      | 8.1    | 504       | 204         |
+----------+----------------+---------------+------------+--------------+----------+--------+-----------+-------------+
4 rows in set (0.01 sec)

mysql> SELECT * FROM Director;
+-------------+-------------------+------------+------------+----------------------+
| director_id | name              | experience | contact    | awards_won           |
+-------------+-------------------+------------+------------+----------------------+
| 201         | Christopher Nolan | 25         | 9876543210 | Oscar Winner         |
| 202         | Rajkumar Hirani   | 20         | 9988776655 | Filmfare Winner      |
| 203         | James Cameron     | 35         | 8877665544 | Golden Globe Winner  |
| 204         | S.S. Rajamouli    | 22         | 7766554433 | National Award Winner|
+-------------+-------------------+------------+------------+----------------------+
4 rows in set (0.01 sec)

mysql> SELECT * FROM Actor;
+----------+---------------------+-----+--------+------------+-------------+
| actor_id | name                | age | gender | experience | nationality |
+----------+---------------------+-----+--------+------------+-------------+
| 301      | Leonardo DiCaprio   | 48  | Male   | 30         | American    |
| 302      | Aamir Khan          | 58  | Male   | 35         | Indian      |
| 303      | Matthew McConaughey | 54  | Male   | 30         | American    |
| 304      | Prabhas             | 44  | Male   | 20         | Indian      |
+----------+---------------------+-----+--------+------------+-------------+
4 rows in set (0.01 sec)

mysql> SELECT * FROM Contract;
+------------+----------+----------+--------------+-----------+---------------+
| contract_id | actor_id | movie_id | role        | salary    | contract_term |
+------------+----------+----------+--------------+-----------+---------------+
| 401        | 301      | 101      | Lead Actor  | 20000000  | 2 Years       |
| 402        | 302      | 102      | Lead Actor  | 15000000  | 3 Years       |
| 403        | 303      | 103      | Lead Actor  | 18000000  | 2 Years       |
| 404        | 304      | 104      | Lead Actor  | 10000000  | 1 Year        |
+------------+----------+----------+--------------+-----------+---------------+
4 rows in set (0.01 sec)

mysql> SELECT * FROM Studio;
+-----------+----------------------+---------+------------+----------------+
| studio_id | name                 | country | contact    | partnership_type |
+-----------+----------------------+---------+------------+----------------+
| 501       | Warner Bros          | USA     | 1234567890 | Major          |
| 502       | Vinod Chopra Films   | India   | 9988771122 | Independent    |
| 503       | Paramount Pictures   | USA     | 8877662211 | Major          |
| 504       | Arka Media Works     | India   | 7766551133 | Independent    |
+-----------+----------------------+---------+------------+----------------+
4 rows in set (0.01 sec)

mysql> SELECT * FROM Distributor;
+--------------+------------------------+---------+------------+----------------+
| distributor_id | name                  | country | contact    | partnership_type |
+--------------+------------------------+---------+------------+----------------+
| 601          | Warner Bros Distribution | USA     | 1122334455 | Global         |
| 602          | Reliance Entertainment   | India   | 2233445566 | Domestic       |
| 603          | 20th Century Fox         | USA     | 3344556677 | Global         |
| 604          | Yash Raj Films           | India   | 4455667788 | Domestic       |
+--------------+------------------------+---------+------------+----------------+
4 rows in set (0.01 sec)

mysql> SELECT * FROM Marketing_Campaign;
+-------------+----------+------------+---------------------+-----------------------+
| campaign_id | movie_id | budget     | strategy           | social_media_presence |
+-------------+----------+------------+---------------------+-----------------------+
| 701         | 101      | 5000000.00 | Online and Theatrical | Extensive           |
| 702         | 102      | 3000000.00 | TV and Social Media  | Moderate            |
| 703         | 103      | 6000000.00 | Global Campaign      | Extensive           |
| 704         | 104      | 2000000.00 | Regional Ads        | Limited             |
+-------------+----------+------------+---------------------+-----------------------+
4 rows in set (0.01 sec)

mysql> SELECT * FROM Box_Office_Collection;
+--------------+----------+------------+--------------+--------------------------+
| collection_id | movie_id | revenue    | ticket_sales | opening_weekend_earnings |
+--------------+----------+------------+--------------+--------------------------+
| 801          | 101      | 830000000  | 100000000    | 62000000.00              |
| 802          | 102      | 390000000  | 80000000     | 55000000.00              |
| 803          | 103      | 677000000  | 120000000    | 75000000.00              |
| 804          | 104      | 280000000  | 90000000     | 47000000.00              |
+--------------+----------+------------+--------------+--------------------------+
4 rows in set (0.01 sec)

mysql> SELECT * FROM Streaming_Platform;
+-------------+--------------+----------------+----------------------+
| platform_id | name         | subscription_model | country_availability |
+-------------+--------------+----------------+----------------------+
| 901         | Netflix      | Subscription   | Worldwide            |
| 902         | Amazon Prime | Subscription   | Worldwide            |
| 903         | Hotstar      | Subscription   | India                |
| 904         | Hulu         | Subscription   | USA                  |
+-------------+--------------+----------------+----------------------+
4 rows in set (0.01 sec)

mysql> SELECT * FROM Theatre;
+------------+-------------+------------+----------+--------------+
| theatre_id | name        | location   | capacity | no_of_screens |
+------------+-------------+------------+----------+--------------+
| 1001       | PVR Cinemas | Mumbai     | 500      | 7            |
| 1002       | IMAX        | New York   | 700      | 10           |
| 1003       | INOX        | Delhi      | 450      | 5            |
| 1004       | Cinepolis   | Los Angeles | 600     | 8            |
+------------+-------------+------------+----------+--------------+
4 rows in set (0.01 sec)

mysql> UPDATE Movie 
    -> SET budget = 170000000.00 
    -> WHERE movie_id = 101;
Query OK, 1 row affected (0.03 sec)
Rows matched: 1  Changed: 1  Warnings: 0

mysql> UPDATE Director 
    -> SET experience = 26 
    -> WHERE director_id = 201;
Query OK, 1 row affected (0.02 sec)
Rows matched: 1  Changed: 1  Warnings: 0

mysql> UPDATE Actor 
    -> SET nationality = 'British' 
    -> WHERE actor_id = 303;
Query OK, 1 row affected (0.01 sec)
Rows matched: 1  Changed: 1  Warnings: 0

mysql> UPDATE Contract 
    -> SET salary = 22000000.00 
    -> WHERE contract_id = 401;
Query OK, 1 row affected (0.02 sec)
Rows matched: 1  Changed: 1  Warnings: 0

mysql> UPDATE Distributor 
    -> SET partnership_type = 'International' 
    -> WHERE distributor_id = 602;
Query OK, 1 row affected (0.02 sec)
Rows matched: 1  Changed: 1  Warnings: 0

mysql> UPDATE Theatre 
    -> SET capacity = 750 
    -> WHERE theatre_id = 1002;
Query OK, 1 row affected (0.02 sec)
Rows matched: 1  Changed: 1  Warnings: 0

mysql> SELECT * FROM Box_Office_Collection 
    -> WHERE collection_id = 804;
+--------------+----------+------------+--------------+--------------------------+
| collection_id | movie_id | revenue    | ticket_sales | opening_weekend_earnings |
+--------------+----------+------------+--------------+--------------------------+
| 804          | 104      | 280000000  | 90000000     | 47000000.00              |
+--------------+----------+------------+--------------+--------------------------+
1 row in set (0.01 sec)

mysql> DELETE FROM Box_Office_Collection 
    -> WHERE collection_id = 804;
Query OK, 1 row affected (0.01 sec)

mysql> SELECT * FROM Box_Office_Collection;
+--------------+----------+------------+--------------+--------------------------+
| collection_id | movie_id | revenue    | ticket_sales | opening_weekend_earnings |
+--------------+----------+------------+--------------+--------------------------+
| 801          | 101      | 830000000  | 100000000    | 62000000.00              |
| 802          | 102      | 390000000  | 80000000     | 55000000.00              |
| 803          | 103      | 677000000  | 120000000    | 75000000.00              |
+--------------+----------+------------+--------------+--------------------------+
3 rows in set (0.01 sec)


1. Get all movies with a rating greater than 8.5:
mysql> SELECT title, genre, rating 
    -> FROM Movie 
    -> WHERE rating > 8.5;
+-------------+-----------+--------+
| title       | genre     | rating |
+-------------+-----------+--------+
| Inception   | Sci-Fi    | 8.8    |
| Interstellar| Sci-Fi    | 8.6    |
+-------------+-----------+--------+
2 rows in set (0.01 sec)

2. Find directors who have more than 25 years of experience:
mysql> SELECT name, experience, awards_won 
    -> FROM Director 
    -> WHERE experience > 25;
+-------------------+------------+----------------------+
| name             | experience | awards_won           |
+-------------------+------------+----------------------+
| Christopher Nolan| 26         | Oscar Winner         |
| James Cameron    | 35         | Golden Globe Winner  |
+-------------------+------------+----------------------+
2 rows in set (0.01 sec)

3. Find actors whose salary is greater than 15,000,000:
mysql> SELECT name, salary 
    -> FROM Actor 
    -> JOIN Contract ON Actor.actor_id = Contract.actor_id 
    -> WHERE salary > 15000000;
+---------------------+-----------+
| name               | salary    |
+---------------------+-----------+
| Leonardo DiCaprio  | 22000000  |
| Matthew McConaughey| 18000000  |
+---------------------+-----------+
2 rows in set (0.01 sec)

mysql> SELECT Movie.title, Studio.name AS studio_name, Director.name AS director_name 
    -> FROM Movie 
    -> JOIN Studio ON Movie.studio_id = Studio.studio_id 
    -> JOIN Director ON Movie.director_id = Director.director_id;
+-------------+----------------------+-------------------+
| title       | studio_name          | director_name    |
+-------------+----------------------+-------------------+
| Inception   | Warner Bros          | Christopher Nolan |
| 3 Idiots    | Vinod Chopra Films   | Rajkumar Hirani   |
| Interstellar| Paramount Pictures   | James Cameron     |
| Baahubali   | Arka Media Works     | S.S. Rajamouli    |
+-------------+----------------------+-------------------+
4 rows in set (0.01 sec)


5. Find all distributors with a global partnership type
mysql> SELECT name, partnership_type 
    -> FROM Distributor 
    -> WHERE partnership_type = 'Global';
+------------------------+------------+
| name                  | partnership_type |
+------------------------+------------+
| Warner Bros Distribution | Global   |
| 20th Century Fox         | Global   |
+------------------------+------------+
2 rows in set (0.01 sec)

6. Find all theatres with a seating capacity greater than 500:
mysql> SELECT name, location, capacity 
    -> FROM Theatre 
    -> WHERE capacity > 500;
+------------+-------------+----------+
| name       | location    | capacity |
+------------+-------------+----------+
| IMAX       | New York    | 750      |
| Cinepolis  | Los Angeles| 600      |
+------------+-------------+----------+
2 rows in set (0.01 sec)

7. Get movies along with their box office revenue, sorted from highest to lowest revenue:
mysql> SELECT title, revenue 
    -> FROM Movie 
    -> JOIN Box_Office_Collection 
    -> ON Movie.movie_id = Box_Office_Collection.movie_id 
    -> ORDER BY revenue DESC;
+-------------+------------+
| title       | revenue    |
+-------------+------------+
| Inception   | 830000000  |
| Interstellar| 677000000  |
| 3 Idiots    | 390000000  |
+-------------+------------+
3 rows in set (0.01 sec)
